{
  "name": "Lorem pariatur",
  "id": "sit eu ut deserunt",
  "additionalNameType": "adipisicing deserunt et",
  "auditInfo": {
    "isDeleted": null,
    "createdBy": "dolore elit enim",
    "updatedBy": "sint pariatur velit",
    "updatedDate": "2019-07-25T01:20:09.479Z",
    "createdDate": "1998-09-27T10:00:23.308Z"
  },
  "party": [
    "dolore reprehenderit"
  ]
}
